{
    "$schema": "http://json-schema.org/draft-07/schema#",
    "title": "Error",
    "description": "RFC 9457 problem details with FastBuyJSON error code",
    "type": "object",
    "required": [
        "type",
        "title",
        "status",
        "code"
    ],
    "properties": {
        "type": {
            "type": "string",
            "format": "uri",
            "description": "URI reference identifying the problem type",
            "examples": [
                "https://fastbuyjson.dev/errors/validation"
            ]
        },
        "title": {
            "type": "string",
            "description": "Short, human-readable summary of the problem",
            "examples": [
                "Validation failed"
            ]
        },
        "status": {
            "type": "integer",
            "description": "HTTP status code",
            "examples": [
                400
            ]
        },
        "code": {
            "type": "string",
            "description": "Machine-readable error code",
            "examples": [
                "INVALID_REQUEST"
            ]
        },
        "detail": {
            "type": "string",
            "description": "Human-readable explanation specific to this occurrence",
            "examples": [
                "The cartId field is required."
            ]
        },
        "instance": {
            "type": "string",
            "format": "uri",
            "description": "URI reference identifying this specific occurrence",
            "examples": [
                "https://example.com/api/fastbuyjson/checkout/initiate"
            ]
        },
        "errors": {
            "type": "array",
            "description": "Field-level validation errors",
            "items": {
                "type": "object",
                "required": [
                    "field",
                    "message"
                ],
                "properties": {
                    "field": {
                        "type": "string",
                        "description": "JSON pointer or field name",
                        "examples": [
                            "cartId"
                        ]
                    },
                    "message": {
                        "type": "string",
                        "description": "Error message for the field",
                        "examples": [
                            "Field is required"
                        ]
                    }
                }
            }
        }
    }
}
